### ISSUE TITLE
The VF function of pf_ring 7.6.0 in the vxlan environment，got the following error “4 bytes missing!”

### ISSUE THREAD

**Issue by wangly2020** [ntop/PF_RING#573]
In the vxlan environment, tried the VF function of pf_ring 7.6.0 version, using the modified tcpdump to capture packets, "4 bytes missing!"
Examples：
[root@sriov6-nat ~]# tcpdump -i zc:ens5 -vvv
#########################################################################
# ERROR: You do not seem to have a valid PF_RING ZC 7.6.0.200220
# license for ens5 (MAC FA:16:xx:xx:70:DE) [Intel 10 Gbit ixgbe VF]
# ERROR: Missing license file
# ERROR: Please get one at http://shop.ntop.org/
#########################################################################
# We're now working in demo mode with packet capture and          
# transmission limited to 5 minutes
#########################################################################
tcpdump: listening on zc:ens5, link-type EN10MB (Ethernet), capture size 262144 bytes

16:39:34.393016 IP truncated-ip - 4 bytes missing! (tos 0x0, ttl 58, id 29043, offset 0, flags [DF], proto UDP (17), length 1450)
    10.xx.xx.22.42783 > sriov6-nat.4789: [no cksum] VXLAN, flags [I] (0x08), vni 200
IP (tos 0x0, ttl 63, id 33970, offset 0, flags [DF], proto TCP (6), length 1400)
    192.168.200.10.http > 10.yy.yy.21.16712: Flags [.], seq 55172:56532, ack 441, win 245, length 1360: HTTP
16:39:34.393032 IP truncated-ip - 4 bytes missing! (tos 0x0, ttl 58, id 29044, offset 0, flags [DF], proto UDP (17), length 1450)
    10.xx.xx.22.42783 > sriov6-nat.4789: [no cksum] VXLAN, flags [I] (0x08), vni 200
IP (tos 0x0, ttl 63, id 33971, offset 0, flags [DF], proto TCP (6), length 1400)
    192.168.200.10.http > 10.yy.yy.21.16712: Flags [.], seq 56532:57892, ack 441, win 245, length 1360: HTTP
16:39:34.393047 IP truncated-ip - 4 bytes missing! (tos 0x0, ttl 58, id 29045, offset 0, flags [DF], proto UDP (17), length 1450)
    10.xx.xx.22.42783 > sriov6-nat.4789: [no cksum] VXLAN, flags [I] (0x08), vni 200
IP (tos 0x0, ttl 63, id 33972, offset 0, flags [DF], proto TCP (6), length 1400)
    192.168.200.10.http > 10.yy.yy.21.16712: Flags [.], seq 57892:59252, ack 441, win 245, length 1360: HTTP
16:39:34.393062 IP truncated-ip - 4 bytes missing! (tos 0x0, ttl 58, id 29046, offset 0, flags [DF], proto UDP (17), length 1450)
    10.xx.xx.22.42783 > sriov6-nat.4789: [no cksum] VXLAN, flags [I] (0x08), vni 200
IP (tos 0x0, ttl 63, id 33973, offset 0, flags [DF], proto TCP (6), length 1400)
    192.168.200.10.http > 10.yy.yy.21.16712: Flags [.], seq 59252:60612, ack 441, win 245, length 1360: HTTP
16:39:34.393077 IP truncated-ip - 4 bytes missing! (tos 0x0, ttl 58, id 29047, offset 0, flags [DF], proto UDP (17), length 1450)
    10.xx.xx.22.42783 > sriov6-nat.4789: [no cksum] VXLAN, flags [I] (0x08), vni 200
And get the configuration information of the Ethernet card，the “rx-vlan-offload: on [fixed]”，“tx-vlan-offload: on [fixed]” are fixed。

[root@sriov6-nat src]# ethtool -k ens5
Features for ens5:
rx-checksumming: on
tx-checksumming: on
	tx-checksum-ipv4: off [fixed]
	tx-checksum-ip-generic: on
	tx-checksum-ipv6: off [fixed]
	tx-checksum-fcoe-crc: off [fixed]
	tx-checksum-sctp: on
scatter-gather: on
	tx-scatter-gather: on
	tx-scatter-gather-fraglist: off [fixed]
tcp-segmentation-offload: on
	tx-tcp-segmentation: on
	tx-tcp-ecn-segmentation: off [fixed]
	tx-tcp6-segmentation: on
	tx-tcp-mangleid-segmentation: off
udp-fragmentation-offload: off [fixed]
generic-segmentation-offload: on
generic-receive-offload: on
large-receive-offload: off [fixed]
rx-vlan-offload: on [fixed]
tx-vlan-offload: on [fixed]
ntuple-filters: off [fixed]
receive-hashing: off [fixed]
highdma: on [fixed]
rx-vlan-filter: on [fixed]
vlan-challenged: off [fixed]
tx-lockless: off [fixed]
netns-local: off [fixed]
tx-gso-robust: off [fixed]
tx-fcoe-segmentation: off [fixed]
tx-gre-segmentation: on
tx-ipip-segmentation: on
tx-sit-segmentation: on
tx-udp_tnl-segmentation: on
tx-mpls-segmentation: off [fixed]
fcoe-mtu: off [fixed]
tx-nocache-copy: off
loopback: off [fixed]
rx-fcs: off [fixed]
rx-all: off [fixed]
tx-vlan-stag-hw-insert: off [fixed]
rx-vlan-stag-hw-parse: off [fixed]
rx-vlan-stag-filter: off [fixed]
busy-poll: on [fixed]
tx-gre-csum-segmentation: on
tx-udp_tnl-csum-segmentation: on
tx-gso-partial: on
tx-sctp-segmentation: off [fixed]
l2-fwd-offload: off [fixed]
hw-tc-offload: off [fixed]

**Comment by cardigliano** [comment]
@wangly2020 could you provide a small pcap with a few packets captured on top of this vf?
You can use pfcount -i zc:ens5 -o dump.pcap -N 10 (you should get dump.pcap.1 as output)

**Comment by wangly2020** [comment]
Here is my pcap info:

[root@sriov6-nat ~]# pfcount -i zc:ens5 -o dump.pcap -N 10
#########################################################################
# ERROR: You do not seem to have a valid PF_RING ZC 7.6.0.200220
# license for ens5 (MAC FA:xx:xx:xx:xx:DE) [Intel 10 Gbit ixgbe VF]
# ERROR: Missing license file
# ERROR: Please get one at http://shop.ntop.org/
#########################################################################
# We're now working in demo mode with packet capture and          
# transmission limited to 5 minutes
#########################################################################
Using PF_RING v.7.6.0
Capturing from zc:ens5 [mac: FA:xx:xx:xx:xx:DE][if_index: 19][speed: 10000Mb/s]
# Device RX channels: 1
# Polling threads:    1
Dumping statistics on /proc/net/pf_ring/stats/13695-ens5.5
=========================
Absolute Stats: [0 pkts total][0 pkts dropped][0.0% dropped]
[0 pkts rcvd][0 bytes rcvd]
=========================

Leaving...
=========================
Absolute Stats: [10 pkts total][0 pkts dropped][0.0% dropped]
[10 pkts rcvd][8'201 bytes rcvd][15.03 pkt/sec][0.10 Mbit/sec]
=========================
Actual Stats: [10 pkts rcvd][665.21 ms][15.03 pps][0.00 Gbps]
=========================


[dump.pcap.zip](https://github.com/ntop/PF_RING/files/4486509/dumps.pcap.zip)
ps: Is  three any relationship with rx-vlan-offload: on [fixed]? I think it should be close, but I can't close it when running load_driver.sh in ixgbevf. 

[root@sriov6-nat src]# ./load_driver.sh 
irqbalance: no process found
Configuring ens5
IFACE CORE MASK -> FILE
=======================
ens5 0 1 -> /proc/irq/33/smp_affinity
Cannot change rx-vlan-offload
Could not change any device features

Here is ixgbevf.ko version：
[root@sriov6-nat src]# modinfo /lib/modules/3.10.0-693.21.1.el7.x86_64/updates/drivers/net/ethernet/intel/ixgbevf/ixgbevf.ko
filename:       /lib/modules/3.10.0-693.21.1.el7.x86_64/updates/drivers/net/ethernet/intel/ixgbevf/ixgbevf.ko
version:        4.3.2
license:        GPL
description:    Intel(R) 10 Gigabit Virtual Function Network Driver
author:         Intel Corporation, <linux.nics@intel.com>
retpoline:      Y
rhelversion:    7.4
srcversion:     53CE36A9D0C12B117A2E738
...
depends:        
vermagic:       3.10.0-693.21.1.el7.x86_64 SMP mod_unload modversions

**Comment by wangly2020** [comment]
[dump.pcap.zip](https://github.com/ntop/PF_RING/files/4486622/dump.pcap.zip)

**Comment by cardigliano** [comment]
What happens if you capture without "zc:"?

**Comment by wangly2020** [comment]
Without using zc mode, use “pfcount -i ens5 -o nozc_dump.pcap -N 10” captured 10 packets. The packets is normal.
[nozc_dump.pcap.zip](https://github.com/ntop/PF_RING/files/4508711/nozc_dump.pcap.zip)

**Comment by wangly2020** [comment]
I have already replied on github.






------------------&nbsp;原始邮件&nbsp;------------------
发件人:&nbsp;"Alfredo Cardigliano"<notifications@github.com&gt;;
发送时间:&nbsp;2020年4月21日(星期二) 下午4:01
收件人:&nbsp;"ntop/PF_RING"<PF_RING@noreply.github.com&gt;;
抄送:&nbsp;"silent"<671850598@qq.com&gt;;"Mention"<mention@noreply.github.com&gt;;
主题:&nbsp;Re: [ntop/PF_RING] The VF function of pf_ring 7.6.0 in the vxlan environment，got the following error “4 bytes missing!” (#573)





 
What happens if you capture without "zc:"?

**Comment by cardigliano** [comment]
Please update and try running:
pfcount -i zc:ens5 -F

**Comment by wangly2020** [comment]
I updated the new development version, and captured two pcap files. 
The file named "with_F_dev_dump.pcap.1", I used the command "./pfcount -i zc:ens5 -F -o with_F_dev_dump.pcap -N 10".
The file named "without_F_dev_dump.pcap.1", I used the command "./pfcount -i zc:ens5 -o without_F_dev_dump.pcap -N 10". 

[root@sriov6-nat examples]# pwd
/ids/PF_RING-dev/userland/examples
[root@sriov6-nat examples]# ./pfcount -i zc:ens5 -F -o with_F_dev_dump.pcap -N 10
#########################################################################
...
[root@sriov6-nat examples]# ./pfcount -i zc:ens5 -o without_F_dev_dump.pcap -N 10
#########################################################################
...

[new_dev_version_captured.zip](https://github.com/ntop/PF_RING/files/4509967/new_dev_version_captured.zip)

**Comment by cardigliano** [comment]
Thank you @wangly2020, this was helpful in identifying the issue, we will fix this.

**Comment by wangly2020** [comment]
Hi,
&nbsp; &nbsp;&nbsp;I updated the new development version, and captured two pcap files.
The file named "with_F_dev_dump.pcap.1", I used the command "./pfcount -i zc:ens5 -F -o with_F_dev_dump.pcap -N 10".
The file named "without_F_dev_dump.pcap.1", I used the command "./pfcount -i zc:ens5 -o without_F_dev_dump.pcap -N 10".You can download the pcap files on github.






Thanks.


------------------&nbsp;原始邮件&nbsp;------------------
发件人:&nbsp;"Alfredo Cardigliano"<notifications@github.com&gt;;
发送时间:&nbsp;2020年4月21日(星期二) 晚上7:02
收件人:&nbsp;"ntop/PF_RING"<PF_RING@noreply.github.com&gt;;
抄送:&nbsp;"silent"<671850598@qq.com&gt;;"Mention"<mention@noreply.github.com&gt;;
主题:&nbsp;Re: [ntop/PF_RING] The VF function of pf_ring 7.6.0 in the vxlan environment，got the following error “4 bytes missing!” (#573)





 
Please update and try running:
 pfcount -i zc:ens5 -F

**Comment by wangly2020** [comment]
Thank you! Looking forward to the new version

**Comment by cardigliano** [comment]
@wangly2020 please update and let me know if it is working

**Comment by wangly2020** [comment]
I tried version 7.6 PF_RING and it works fine.
Thanks you very much.

**Comment by cardigliano** [comment]
Thank you
