### ISSUE TITLE
Centos8.3 transparent_mode=2   Packets are sent to the kernel

### ISSUE THREAD

**Issue by hicaoc** [ntop/PF_RING#682]
in centos8.3  kernal 4.18.0-240.1.1.el8_3.x86_64 

insmod ./pf_ring.ko transparent_mode=2 



insmod pf_ring.ko transparent_mode=2
In this mode, packets are sent directly by the NIC driver to PF_RING, packets are not propagated to other kernel components as this slows down packet capture. Please note that:
in order to enable this mode, you must use a NIC driver that supports PF_RING.
**Packets are not sent to the kernel after they have been delivered to PF_RING.** This means that you won’t have connectivity from NICs driven by PF_RING-aware drivers.
This mode is the fastest one as packets are quickly copied to PF_RING and immediately discarded after they have been processed.


# ethtool -i eno3                                                                                                                                                                                                             130 ↵
driver: igb
version: 5.3.5.18_debug
firmware-version: 1.67, 0x80000fa8, 19.5.12
expansion-rom-version: 
bus-info: 0000:01:00.0
supports-statistics: yes
supports-test: yes
supports-eeprom-access: yes
supports-register-dump: yes
supports-priv-flags: no


ring1.SetBPFFilter(“udp and port 9999”)

 # tcpdump -p -i eno3 -nn -c 10 icmp
dropped privs to tcpdump
tcpdump: verbose output suppressed, use -v or -vv for full protocol decode
listening on eno3, link-type EN10MB (Ethernet), capture size 262144 bytes
09:34:08.329003 IP 172.16.100.1 > 172.16.5.68: ICMP 172.16.100.1 udp port 9999 unreachable, length 156
09:34:08.329039 IP 172.16.100.1 > 172.16.5.42: ICMP 172.16.100.1 udp port 9999 unreachable, length 150
09:34:08.329047 IP 172.16.100.1 > 172.16.3.87: ICMP 172.16.100.1 udp port 9999 unreachable, length 157
09:34:08.329058 IP 172.16.100.1 > 172.16.3.158: ICMP 172.16.100.1 udp port 9999 unreachable, length 151
09:34:08.329113 IP 172.16.100.1 > 172.16.3.137: ICMP 172.16.100.1 udp port 9999 unreachable, length 152
09:34:08.329138 IP 172.16.100.1 > 172.16.3.62: ICMP 172.16.100.1 udp port 9999 unreachable, length 155
09:34:08.348946 IP 172.16.100.1 > 172.16.3.202: ICMP 172.16.100.1 udp port 9999 unreachable, length 150
09:34:08.368933 IP 172.16.100.1 > 172.16.5.5: ICMP 172.16.100.1 udp port 9999 unreachable, length 158
09:34:08.368974 IP 172.16.100.1 > 172.16.3.78: ICMP 172.16.100.1 udp port 9999 unreachable, length 170
09:34:08.369053 IP 172.16.100.1 > 172.16.6.29: ICMP 172.16.100.1 udp port 9999 unreachable, length 148


# cd  /proc/net/pf_ring 

# cat 1405555-eno3.3
Bound Device(s)        : eno3
Active                 : 1
Breed                  : Standard
Appl. Name             : /root/test
Socket Mode            : RX only
Capture Direction      : RX only
Sampling Rate          : 1
Filtering Sampling Rate: 0
IP Defragment          : No
BPF Filtering          : Enabled
Sw Filt Hash Rules     : 0
Sw Filt WC Rules       : 0
Sw Filt Hash Match     : 0
Sw Filt Hash Miss      : 0
Sw Filt Hash Filtered  : 0
Hw Filt Rules          : 0
Poll Pkt Watermark     : 128
Num Poll Calls         : 168542
Poll Watermark Timeout : 0
Channel Id Mask        : 0x0000000000000020
VLAN Id                : 65535
Slot Version           : 18 [7.9.0]
Min Num Slots          : 512
Bucket Len             : 65535
Slot Len               : 65592 [bucket+header]
Tot Memory             : 33595392
Tot Packets            : 12008521
Tot Pkt Lost           : 0
Tot Insert             : 12008521
Tot Read               : 12008424
Insert Offset          : 32664696
Remove Offset          : 32643888
Num Free Slots         : 415
Reflect: Fwd Ok        : 0
Reflect: Fwd Errors    : 0

**Comment by cardigliano** [comment]
@hicaoc please note that transparent mode is deprecated, did you find instructions on the web site perhaps? (we need to update them in case)

**Comment by hicaoc** [comment]
Yes, I see the prompt. It's deprecated, but I can't find a description of the replacement function.

**Comment by hicaoc** [comment]
> @hicaoc please note that transparent mode is deprecated, did you find instructions on the web site perhaps? (we need to update them in case)

Yes, I see the prompt. It's deprecated, but I can't find a description of the replacement function.

**Comment by cardigliano** [comment]
@hicaoc if you want to bypass the kernel you should use ZC drivers (igb is supported)

**Comment by hicaoc** [comment]
> @hicaoc if you want to bypass the kernel you should use ZC drivers (igb is supported)

Thank you, I'll test ZC drivers.
