### ISSUE TITLE
Unable to receive packets from stack when zc-device is attached

### ISSUE THREAD

**Issue by atonkyra** [ntop/PF_RING#543]
Comparison at 
https://github.com/ntop/PF_RING/blob/273a937dec2a7c20b1f0dc12cf5fa90327cba55d/kernel/pf_ring.c#L4297

compares against `PACKET_OUTGOING` which seems to cause stack:zcdevice to not receive any packets *from kernel*.

### Reproducer

```
ifconfig enp2s0 up 172.24.32.99/24
./zbounce -i zc:enp2s0 -o stack:enp2s0 -b
```

**Expected result:** I am able to ping 172.24.32.99 via the zc-device from external host
**Actual result:** No ping/arp response is seen, looking with another `pfcount -i stack:enp2s0` no packets are seen

### Test patch
I did a test patch which fixes the issue with some caveats.
```
diff --git a/kernel/pf_ring.c b/kernel/pf_ring.c
index 46072741..e249e89a 100644
--- a/kernel/pf_ring.c
+++ b/kernel/pf_ring.c
@@ -4294,7 +4294,7 @@ static int packet_rcv(struct sk_buff *skb, struct net_device *dev,
   if(skb->pkt_type != PACKET_LOOPBACK) {
     dev_index = ifindex_to_pf_index(dev->ifindex);
      /* avoid loops (e.g. "stack" injected packets captured from kernel) in 1-copy-mode ZC */
-    if (!((skb->pkt_type == PACKET_OUTGOING || skb->queue_mapping == 0xffff /* stack injected */)
+    if (!((skb->queue_mapping == 0xffff /* stack injected */)
           && active_zc_socket[dev_index] == 2)) {
       rc = pf_ring_skb_ring_handler(skb,
                                    skb->pkt_type != PACKET_OUTGOING,
```

#### Caveat: the patch causes small (non-breaking) anomalies when inspecting with tcpdump (non-pfring version):
```
# tcpdump -ni enp2s0 -Q inout
tcpdump: verbose output suppressed, use -v or -vv for full protocol decode
listening on enp2s0, link-type EN10MB (Ethernet), capture size 262144 bytes
18:01:52.532363 IP 172.24.32.1 > 172.24.32.99: ICMP echo request, id 69, seq 942, length 64
18:01:52.532396 IP 172.24.32.99 > 172.24.32.1: ICMP echo reply, id 69, seq 942, length 64
18:01:52.532402 IP 172.24.32.99 > 172.24.32.1: ICMP echo reply, id 69, seq 942, length 64
18:01:53.555377 IP 172.24.32.1 > 172.24.32.99: ICMP echo request, id 69, seq 943, length 64
18:01:53.555408 IP 172.24.32.99 > 172.24.32.1: ICMP echo reply, id 69, seq 943, length 64
18:01:53.555423 IP 172.24.32.99 > 172.24.32.1: ICMP echo reply, id 69, seq 943, length 64
^C
6 packets captured
6 packets received by filter
0 packets dropped by kernel


# tcpdump -ni enp2s0 -Q in
tcpdump: verbose output suppressed, use -v or -vv for full protocol decode
listening on enp2s0, link-type EN10MB (Ethernet), capture size 262144 bytes
18:01:57.651346 IP 172.24.32.1 > 172.24.32.99: ICMP echo request, id 69, seq 947, length 64
18:01:57.651376 IP 172.24.32.99 > 172.24.32.1: ICMP echo reply, id 69, seq 947, length 64
18:01:58.675374 IP 172.24.32.1 > 172.24.32.99: ICMP echo request, id 69, seq 948, length 64
18:01:58.675393 IP 172.24.32.99 > 172.24.32.1: ICMP echo reply, id 69, seq 948, length 64
18:01:59.699362 IP 172.24.32.1 > 172.24.32.99: ICMP echo request, id 69, seq 949, length 64
18:01:59.699468 IP 172.24.32.99 > 172.24.32.1: ICMP echo reply, id 69, seq 949, length 64
^C
6 packets captured
9 packets received by filter
0 packets dropped by kernel


# tcpdump -ni enp2s0 -Q out
tcpdump: verbose output suppressed, use -v or -vv for full protocol decode
listening on enp2s0, link-type EN10MB (Ethernet), capture size 262144 bytes
18:02:01.748321 IP 172.24.32.99 > 172.24.32.1: ICMP echo reply, id 69, seq 951, length 64
18:02:02.772355 IP 172.24.32.99 > 172.24.32.1: ICMP echo reply, id 69, seq 952, length 64
18:02:03.795318 IP 172.24.32.99 > 172.24.32.1: ICMP echo reply, id 69, seq 953, length 64
^C
3 packets captured
9 packets received by filter
0 packets dropped by kernel
```

**Comment by cardigliano** [comment]
@atonkyra this is an expected behaviour: in ZC mode the linux stack is bypassed. If you want to capture packets transmitted from the linux stack, you should remove the zc: prefix.

**Comment by atonkyra** [comment]
@cardigliano I just think it is a bit weird that stack-module stops seeing the packets that the kernel is trying to send (for example responses to the zc:enp2s0 -> stack:enp2s0 packets)? 

I was thinking about making a transparent filtering logic which does a pre-filter before stack sees any traffic. So in essence a (transparent) filtering bridge between the IP stack and the interface with 2-way communication.

Would be awesome to support this configuration :)

```
zc-interface <=> filtering logic <=> normal IP stack
```

But if it isn't feasible feel free to close this issue.

**Comment by atonkyra** [comment]
One way to work around the problem is to use a veth/similar:
```
enp2s0 <=> zbounce -i zc:enp2s0 -o veth0 -b <=> veth0 <=> veth1 (172.24.32.99/24) <-> Linux IP Stack
```

But it would be easier if I could use stack directly:
```
enp2s0 (172.24.32.99/24) <=> zbounce -i zc:enp2s0 -o stack:enp2s0 -b <-> Linux IP Stack
```

**Comment by cardigliano** [comment]
I reworked the patch to fix the stack issue, please check the new code. Thank you.

**Comment by atonkyra** [comment]
Thanks for looking into it! After that the stack reads to do work but running zbounce seems to lead into a loop like in #542 . 

In my test the loop can be fixed by the same logic:
```
diff --git a/kernel/pf_ring.c b/kernel/pf_ring.c
index 40dfd82d..ecf60464 100644
--- a/kernel/pf_ring.c
+++ b/kernel/pf_ring.c
@@ -4293,7 +4293,7 @@ static int packet_rcv(struct sk_buff *skb, struct net_device *dev,
 {
   int rc = 0;

-  if(skb->pkt_type != PACKET_LOOPBACK)
+  if(skb->pkt_type != PACKET_LOOPBACK && skb->queue_mapping != 0xffff)
     rc = pf_ring_skb_ring_handler(skb,
                                  skb->pkt_type != PACKET_OUTGOING,
                                  1 /* real_skb */,
```

**Comment by atonkyra** [comment]
I'm not sure if the actual bug is in the stack module that triggers the loop. Earlier in #542 I was wondering about the duplicate packets when "inspecting the stack" using tcpdump (with above patch applied):

```
# tcpdump -ni enp2s0 -Q in
tcpdump: verbose output suppressed, use -v or -vv for full protocol decode
listening on enp2s0, link-type EN10MB (Ethernet), capture size 262144 bytes
13:42:05.939373 IP 172.24.32.99 > 172.24.32.1: ICMP echo request, id 22289, seq 53, length 64
13:42:05.939452 IP 172.24.32.1 > 172.24.32.99: ICMP echo reply, id 22289, seq 53, length 64
^C
2 packets captured
3 packets received by filter
0 packets dropped by kernel

# tcpdump -ni enp2s0 -Q inout
tcpdump: verbose output suppressed, use -v or -vv for full protocol decode
listening on enp2s0, link-type EN10MB (Ethernet), capture size 262144 bytes
13:43:01.235377 IP 172.24.32.99 > 172.24.32.1: ICMP echo request, id 22289, seq 107, length 64
13:43:01.235450 IP 172.24.32.99 > 172.24.32.1: ICMP echo request, id 22289, seq 107, length 64
13:43:01.235516 IP 172.24.32.1 > 172.24.32.99: ICMP echo reply, id 22289, seq 107, length 64
```

Could it be that whatever "creates" that duplicate packet which is *outgoing* but ends up in *in* **and** *out* direction is causing the loop (maybe in stack logic)?

**Comment by cardigliano** [comment]
I applied a patch similar to what you suggested (injected packets should be ignored in any case).
You can still see duplicate packets in tcpdump if you do not compile/link it with pf_ring or you do not use zc:.

**Comment by atonkyra** [comment]
Confirming it works. Last issue I'm seeing (might be regression from modifications to this code)

```
# ifconfig enp2s0 169.254.0.1/24
# ping 169.254.0.2

And on another terminal
# ./zcount -i enp2s0 -v
<no packets are seen>

# ./zcount -i enp2s0 -v -T
<arp requests are seen, as expected>

# ./zcount -i zc:enp2s0 -v
<arp requests are seen, which is unexpected as we are not supposed to capture TX dir?>

# ./zcount -i zc:enp2s0 -v -T
<arp requests are seen, may be expected?>
```

**Comment by cardigliano** [comment]
@atonkyra if I run those commands, I can see the expected traffic:
./zcount -i enp2s0 -v (RX ICMP only)
./zcount -i enp2s0 -v -T (RX and TX ICMP)
What you see is strange, do you have other interfaces in the same net perhaps?

**Comment by atonkyra** [comment]
@cardigliano No other devices, just a link that is up (in a VM). Did you try with zc:enp2s0 and pinging from the same host that is running zcount -i zc:enp2s0?

**Comment by atonkyra** [comment]
So to clarify, the erroneous case happens with following steps
```
modprobe pf_ring
modprobe e1000e
ifconfig enp2s0 up 169.254.0.1/24
ping 169.254.0.2 &
./zcount -i zc:enp2s0 -v
<ARP packets are seen>
```

Without ZC interface prefix everything works as expected.

**Comment by atonkyra** [comment]
Looking further into the problem I noticed that when opening ZC device the ring RX/TX gets set up differently and is_valid_skb_direction ends up in being RX+TX for ZC interface:

System is running `ping 169.254.0.2` in other terminal and enp2s0 is not receiving any packets. I added a printk to the is_valid_skb_direction to show the state.
```
host1# /usr/src/PF_RING/userland/examples_zc/zcount -i zc:enp2s0
[ 1031.253924] SO_SET_PACKET_DIRECTION [pfr->direction=RX+TX][direction=RX+TX]
[ 1031.605766] SO_SET_PACKET_DIRECTION [pfr->direction=RX+TX][direction=RX+TX]
[ 1031.626200] device enp2s0 entered promiscuous mode
[ 1032.626548] SO_SET_PACKET_DIRECTION [pfr->direction=RX only][direction=RX only]
[ 1038.373762] is_valid_skb_direction [direction=RX+TX][recv_packet=0]
[ 1039.405032] is_valid_skb_direction [direction=RX+TX][recv_packet=0]
[ 1040.429018] is_valid_skb_direction [direction=RX+TX][recv_packet=0]
[ 1042.381307] device enp2s0 left promiscuous mode


host1# /usr/src/PF_RING/userland/examples_zc/zcount -i enp2s0
[ 1050.237945] device enp2s0 entered promiscuous mode
[ 1050.238097] SO_SET_PACKET_DIRECTION [pfr->direction=RX only][direction=RX only]
[ 1056.443643] is_valid_skb_direction [direction=RX only][recv_packet=0]
[ 1057.452773] is_valid_skb_direction [direction=RX only][recv_packet=0]
[ 1058.476749] is_valid_skb_direction [direction=RX only][recv_packet=0]
[ 1062.100904] device enp2s0 left promiscuous mode

```

**Comment by cardigliano** [comment]
I pushed a lib update that should fix this, please check it.

**Comment by atonkyra** [comment]
Yep, looks like everything that I've tested is working so I'll close this one. Thanks!

**Comment by cardigliano** [comment]
This code has been reworked as discarding stack-injected packets in any case was breaking backward compatibility (legacy API):
- In ZC mode, stack-injected packets are still discarded by default
- With the legacy API, the PF_RING_DISCARD_INJECTED_PKTS flag should be provided to pfring_open to discard stack-injected packets

**Comment by atonkyra** [comment]
Alright, the changes did introduce a regression, though.

pfcount.c patched with
```patch
--- a/userland/examples/pfcount.c
+++ b/userland/examples/pfcount.c
@@ -1157,6 +1157,8 @@ int main(int argc, char* argv[]) {
   /* flags |= PF_RING_FLOW_OFFLOAD | PF_RING_FLOW_OFFLOAD_NOUPDATES;  to receive FlowID on supported adapters*/
   /* flags |= PF_RING_USERSPACE_BPF; to force userspace BPF even with kernel capture  */

+  flags |= PF_RING_DISCARD_INJECTED_PKTS;
+
   pd = pfring_open(device, snaplen, flags);

   if(pd == NULL) {
```

Terminal 1
```
make && ./pfcount -i zc:enp2s0
...
=========================
Absolute Stats: [0 pkts total][0 pkts dropped][0.0% dropped]
[0 pkts rcvd][0 bytes rcvd][0.00 pkt/sec][0.00 Mbit/sec]
=========================
Actual Stats: [0 pkts rcvd][1'000.04 ms][0.00 pps][0.00 Gbps]
=========================

=========================
Absolute Stats: [1'234 pkts total][0 pkts dropped][0.0% dropped]
[1'234 pkts rcvd][103'656 bytes rcvd][205.66 pkt/sec][0.14 Mbit/sec]
=========================
Actual Stats: [1'234 pkts rcvd][1'000.04 ms][1'233.94 pps][0.00 Gbps]
=========================
```

Terminal 2 (while running pfcount on terminal 1)
```
./pfsend -i stack:enp2s0 -n 1234
Sending packets on stack:enp2s0
Using PF_RING v.7.5.0
Dumping statistics on /proc/net/pf_ring/stats/5435-enp2s0.42
TX rate: [current 855'162.85 pps/0.57 Gbps][average 855'162.85 pps/0.57 Gbps][total 1'234.00 pkts]
Sent 1234 packets
```

I'd expect the number of received packets would be 0. Specifying -e 1 to pfcount does not make a difference.

**Comment by atonkyra** [comment]
Small test using pfbridge reveals some kind of regression:

```
diff --git a/userland/examples/pfbridge.c b/userland/examples/pfbridge.c
index dc321fa5..babf44f3 100644
--- a/userland/examples/pfbridge.c
+++ b/userland/examples/pfbridge.c
@@ -120,7 +120,7 @@ int main(int argc, char* argv[]) {


   /* Device A */
-  if((a_ring = pfring_open(a_dev, MAX_PKT_LEN, PF_RING_PROMISC | PF_RING_LONG_HEADER |
+  if((a_ring = pfring_open(a_dev, MAX_PKT_LEN, PF_RING_DISCARD_INJECTED_PKTS | PF_RING_PROMISC | PF_RING_LONG_HEADER |
                            (use_pfring_send ? 0 : PF_RING_RX_PACKET_BOUNCE))
     ) == NULL) {
     printf("pfring_open error for %s [%s]\n", a_dev, strerror(errno));
@@ -144,7 +144,7 @@ int main(int argc, char* argv[]) {

   /* Device B */

-  if((b_ring = pfring_open(b_dev, MAX_PKT_LEN, PF_RING_PROMISC|PF_RING_LONG_HEADER)) == NULL) {
+  if((b_ring = pfring_open(b_dev, MAX_PKT_LEN, PF_RING_DISCARD_INJECTED_PKTS | PF_RING_PROMISC|PF_RING_LONG_HEADER)) == NULL) {
     printf("pfring_open error for %s [%s]\n", b_dev, strerror(errno));
     pfring_close(a_ring);
     return(-1);
```

```
./pfbridge -a zc:enp2s0 -b stack:enp2s0 -p
#########################################################################
# ERROR: You do not seem to have a valid PF_RING ZC 7.5.0.200121
# license for enp2s0 (MAC 52:54:00:DC:67:3B) [Intel 1 Gbit e1000e family]
# ERROR: Missing license file
# ERROR: Please get one at http://shop.ntop.org/
#########################################################################
# We're now working in demo mode with packet capture and
# transmission limited to 5 minutes
#########################################################################
0 pps
0 pps
0 pps
<send ARP on interface from remote end,  local stack generated packets do NOT generate loop>
527'819 pps
1'068'787 pps
1'066'551 pps
```

**Comment by atonkyra** [comment]
It seems that this only is a problem on e1000e. With ixgbe everything seems to work as expected.

**Comment by cardigliano** [comment]
@atonkyra what you've seen with pfcount is an expected behavior (it used to work this way), please add PF_RING_DISCARD_INJECTED_PKTS to your MITM application, all other applications should capture injected packets by default.

**Comment by cardigliano** [comment]
I will add the flag to pfbridge as it probably does not make sense to capture injected packets anyway.
