### ISSUE TITLE
Potential Issue in PFRING-9.2.0 Standard Mode: Duplicate Packet Reception

### ISSUE THREAD

**Issue by huxq2199** [ntop/PF_RING#1014]
Hi,
In our testing environment, we have observed what appears to be a possible defect in PFRING-9.2.0 standard mode. Both pfring_recv() and pfring_stats() report receiving duplicate packets (double the actual count), while the network interface statistics display normal packet counts.
Key Points:
The same code and environment function correctly with PF_RING-8.8.0
Testing conducted on a CentOS 7.9 server with kernel upgraded to 5.18.10-1.el7.elrepo.x86_64
Hardware: 6-port Intel 125c network cards
Test setup: Direct cable connection between Port 1 and Port 2
DPDK packet generator transmits from Port 1
Our packet capture program (developed using PFRING-9.2.0 standard mode cluster) receives on Port 2 in promiscuous mode
Issue: Both receive functions and statistics show double the actual packet count compared to NIC statistics
This discrepancy suggests a potential bug in PFRING-9.2.0's standard mode implementation that causes duplicate packet processing.

**Comment by cardigliano** [comment]
@huxq2199 definitely not a known issue. What driver are you running on the rx interface?

**Comment by huxq2199** [comment]
> [@huxq2199](https://github.com/huxq2199) definitely not a known issue. What driver are you running on the rx interface?

I am currently using the igc driver​ for the rx interface. The detailed information is as follows:
[root@hh ~]# ethtool -i  enp4s0
driver: igc
version: 5.18.10-1.el7.elrepo.x86_64
firmware-version: 2014:8877
expansion-rom-version: 
bus-info: 0000:04:00.0
supports-statistics: yes
supports-test: yes
supports-eeprom-access: yes
supports-register-dump: yes
supports-priv-flags: yes

If necessary, I can also provide the relevant test code.

**Comment by cardigliano** [comment]
@huxq2199 could you reproduce the same with pfcount -i enp4s0 ?

**Comment by huxq2199** [comment]
> pfcount -i enp4s0

All right, I will use pfcount -i enp4s0to verify. However, please wait a moment—I need to upgrade the test environment from PFRING 8 to PFRING 9.2.0 again.

**Comment by huxq2199** [comment]
@cardigliano
I have rebuilt the test environment with PFRING 9.2.0 and easily reproduced the issue.
After sending 3 packets, the packet count in /sys/class/net/enp4s0/statistics/rx_packets increased by 3,
    [root@hh bin]# cat /sys/class/net/enp4s0/statistics/rx_packets
    644777498
    [root@hh bin]# cat /sys/class/net/enp4s0/statistics/rx_packets
    644777501
But ”pfcount -i enp4s0“ displayed "[6 pkts rcvd]":
=========================
Absolute Stats: [6 pkts total][0 pkts dropped][0.0% dropped]
[6 pkts rcvd][528 bytes rcvd][1.20 pkt/sec][0.00 Mbit/sec]
Actual Stats: [6 pkts rcvd][1'000.13 ms][6.00 pps][0.00 Gbps]
=========================

This issue has been puzzling me, and I am unsure where the discrepancy originates.

**Comment by cardigliano** [comment]
I will try to reproduce, please also try with this in the meanwhile: pfcount -i enp4s0 -e 1

**Comment by huxq2199** [comment]
Sending 3 packets, the output information of ”pfcount -i enp4s0 -e 1“ is as follows:
[root@hh bin]# ./pfcount -i enp4s0 -e 1
Using PF_RING v.9.2.0.251117 kernel module v.9.2.0
Dumping statistics on /proc/net/pf_ring/stats/6801-enp4s0.13
Capturing from enp4s0 [mac: 60:BE:B4:19:6F:0A][if_index: 4][speed: 0Mb/s]
# Device RX channels: 4
# Polling threads:    1

=========================
Absolute Stats: [0 pkts total][0 pkts dropped][0.0% dropped]
[0 pkts rcvd][0 bytes rcvd][0.00 pkt/sec][0.00 Mbit/sec]
=========================
Actual Stats: [0 pkts rcvd][1'000.11 ms][0.00 pps][0.00 Gbps]
=========================

=========================
Absolute Stats: [6 pkts total][0 pkts dropped][0.0% dropped]
[6 pkts rcvd][528 bytes rcvd][3.00 pkt/sec][0.00 Mbit/sec]
=========================
Actual Stats: [6 pkts rcvd][1'000.13 ms][6.00 pps][0.00 Gbps]
=========================

=========================
Absolute Stats: [6 pkts total][0 pkts dropped][0.0% dropped]
[6 pkts rcvd][528 bytes rcvd][2.00 pkt/sec][0.00 Mbit/sec]
=========================
Actual Stats: [0 pkts rcvd][1'000.13 ms][0.00 pps][0.00 Gbps]
=========================

**Comment by cardigliano** [comment]
@huxq2199 I realized you are running on centos 7 which is no longer supported, I ran some test on other OS versions (and different adapters) and it seems to be working fine for me. This is weird. Could you run pfcount with -v 1 and provide the output for a few packets? Thank you

**Comment by huxq2199** [comment]
@cardigliano  Here is the output from pfcount with -v 1.

[root@hh bin]# ./pfcount -i enp4s0 -v 1
Using PF_RING v.9.2.0.251117 kernel module v.9.2.0
Dumping statistics on /proc/net/pf_ring/stats/3058-enp4s0.6
Capturing from enp4s0 [mac: 60:BE:B4:19:6F:0A][if_index: 4][speed: 10Mb/s]
# Device RX channels: 4
# Polling threads:    1
23:28:55.760458845 [RX][if_index=4][hash=2169630838][00:E0:4C:20:D0:93 -> 60:BE:B4:19:6F:08] [IPv4][192.168.137.1:56913 -> 192.168.137.8:22] [l3_proto=TCP][hash=2169630838][tos=0][tcp_seq_num=1799677051] [caplen=66][len=66][eth_offset=0][l3_offset=14][l4_offset=34][payload_offset=66]
23:28:55.760462591 [RX][if_index=4][hash=2169630838][60:BE:B4:19:6F:08 -> 00:E0:4C:20:D0:93] [IPv4][192.168.137.8:22 -> 192.168.137.1:56913] [l3_proto=TCP][hash=2169630838][tos=0][tcp_seq_num=2989787562] [caplen=66][len=66][eth_offset=0][l3_offset=14][l4_offset=34][payload_offset=66]
23:28:55.760458845 [RX][if_index=4][hash=2169630838][00:E0:4C:20:D0:93 -> 60:BE:B4:19:6F:08] [IPv4][192.168.137.1:56913 -> 192.168.137.8:22] [l3_proto=TCP][hash=2169630838][tos=0][tcp_seq_num=1799677051] [caplen=66][len=66][eth_offset=0][l3_offset=14][l4_offset=34][payload_offset=66]
23:28:55.760468590 [RX][if_index=4][hash=2169630838][00:E0:4C:20:D0:93 -> 60:BE:B4:19:6F:08] [IPv4][192.168.137.1:56913 -> 192.168.137.8:22] [l3_proto=TCP][hash=2169630838][tos=0][tcp_seq_num=1799677052] [caplen=60][len=60][eth_offset=0][l3_offset=14][l4_offset=34][payload_offset=54]
23:28:55.760468590 [RX][if_index=4][hash=2169630838][00:E0:4C:20:D0:93 -> 60:BE:B4:19:6F:08] [IPv4][192.168.137.1:56913 -> 192.168.137.8:22] [l3_proto=TCP][hash=2169630838][tos=0][tcp_seq_num=1799677052] [caplen=60][len=60][eth_offset=0][l3_offset=14][l4_offset=34][payload_offset=54]
23:28:55.760462591 [RX][if_index=4][hash=2169630838][60:BE:B4:19:6F:08 -> 00:E0:4C:20:D0:93] [IPv4][192.168.137.8:22 -> 192.168.137.1:56913] [l3_proto=TCP][hash=2169630838][tos=0][tcp_seq_num=2989787562] [caplen=66][len=66][eth_offset=0][l3_offset=14][l4_offset=34][payload_offset=66] 

Attachment 3.zip is my test data (pcap file).

[3.zip](https://github.com/user-attachments/files/24824213/3.zip)

I will switch to Ubuntu later for testing to see if the issue can be reproduced.

**Comment by Roslaniec** [comment]
Hi,
I encounter very the same issue (in details: it's even worse). Let me give some broad explanation.
I've been using pf-ring for many years already, so I have experience with it. But this time I had a new environment.

It all started with gretap interface: ip link add gre0 type gretap local ... dev eno5
I was trying to use pf_ring to capture traffic from gre0 and it failed miserably!
PF-RING was capturing/delivering garbage! It was not even duplicated, but completely crazy statistics and content!
At the same time, tcpdump/libpcap was capturing perfectly normal/correct packets.

Trying to simplify the issue, I skipped gretap interface and started to test PF-RING on regular NIC or "dummy" (virtual) interfaces. And what I experienced was very strange: PF-RING is duplicating all packets. Namely: every single packet is duplicated with the same timestamp on the capture file. This is reproducible on physical-NIC traffic and also on "dummy" interfaces.

Next scenario I was testing...
 I've modified ~/PF_RING-dev/userland/examples/preflect.c:
```
unsigned count = 0, errors = 0;
time_t curtime = 0;
void dummyProcesssPacket(u_char *_deviceId,
                         const struct pcap_pkthdr *h,
                         const u_char *p) {
  count++;
  if (pcap_sendpacket(out_pd, p, h->caplen)) errors++;
  if (h->ts.tv_sec <= curtime) return;
  printf("pcap_sendpacket count: %d, errors: %d\n", count, errors);
  curtime = h->ts.tv_sec;
  count = errors = 0;
}
```
`preflect` copies packets from NIC to dummy usr0 interface.
Important: you _must_ also modify Makefile, and make sure that `preflect` will be linked to regular libpcap.so library.
By default it links to pf-ring-libpcap which is also broken!
I've tested it like this:
```
./preflect -i eno5 -o usr0 -l 1800
./pfcount -i usr0 -e2
```
And it showed also the problem: `PF-RING` is receiving x2 times packets than `preflect` is sending...

The next step, before filling bug report, was to test it on different machine, and... this was surprising... no issue!
PF-RING was working OK.

Thus, at this point, I'm quite sure the problem with PF-RING must be related with the OS. 
It might be the kernel version, or some specific modules loaded, or something similar...
BTW, I've performed tests with **8.9** and **9.3** (**dev**). 

Anyhow: 
1. The issue is visible on `Rocky Linux release 9.6 (Blue Onyx)`, tested with PF-RING 8.9 & 9.3 (dev)
```
uname -a
Linux 5.14.0-570.25.1.el9_6.x86_64 #1 SMP PREEMPT_DYNAMIC Mon Jul 7 18:09:10 UTC 2025 x86_64 x86_64 x86_64 GNU/Linux
```
2. The issue does not happen on `Debian 12.13` (here I have tested only PF-RING 8.9)
```
Linux 6.1.0-42-amd64 #1 SMP PREEMPT_DYNAMIC Debian 6.1.159-1 (2025-12-30) x86_64 GNU/Linux
```

As a summary: although in simple tests this issue appears as to produce __duplicated__ packets, I think the issue must be more serious. When PF-RING is reading directly from **gretap** interface it delivers crazy stuff, close to garbage.

Best Regards,
Karol

**Comment by Roslaniec** [comment]
Update from me... 
I've made some more tests as simple as possible on "virgin" system: Rocky 9.6 OS, minimal (or nearly minimal), without any fancy software installed.
```
# cat /etc/rocky-release
Rocky Linux release 9.6 (Blue Onyx)
# uname -a
Linux nqp 5.14.0-570.25.1.el9_6.x86_64 #1 SMP PREEMPT_DYNAMIC Mon Jul 7 18:09:10 UTC 2025 x86_64 x86_64 x86_64 GNU/Linux
```

I've decided to use `examples/pfdump.c` (you must add some directives to Makefile to compile it)
eno1 NIC is `NetXtreme BCM5719 Gigabit Ethernet PCIe`, but this really doesn't matter. 
Yesterday I was doing tests on _dummy_ interface or `Ethernet Controller X710 for 10GbE SFP+` NIC with the same effect.

```
# ./pfdump -i eno1 -w k.pcap
Using PF_RING v.9.3.0
Capturing from eno1 [08:FF:EE:6F:88:EC][ifIndex: 2]
# Device RX channels: 1
1 sec pkts 2 drop 0 bytes 168 | pkts 2 bytes 168 drop 0
2 sec pkts 2 drop 0 bytes 168 | pkts 4 bytes 336 drop 0
3 sec pkts 2 drop 0 bytes 168 | pkts 6 bytes 504 drop 0
4 sec pkts 2 drop 0 bytes 168 | pkts 8 bytes 672 drop 0
5 sec pkts 2 drop 0 bytes 168 | pkts 10 bytes 840 drop 0
6 sec pkts 2 drop 0 bytes 168 | pkts 12 bytes 1008 drop 0
7 sec pkts 2 drop 0 bytes 168 | pkts 14 bytes 1176 drop 0
8 sec pkts 2 drop 0 bytes 168 | pkts 16 bytes 1344 drop 0
Leaving...
9 sec pkts 0 drop 0 bytes 0 | pkts 16 bytes 1344 drop 0
```

```
# tcpdump -nnr k.pcap
reading from file k.pcap, link-type EN10MB (Ethernet), snapshot length 16384
dropped privs to tcpdump
20:23:05.214297 IP 10.10.10.140.37307 > 10.10.7.4.22: Flags [.], ack 2609746409, win 1021, length 0
20:23:05.214297 IP 10.10.10.140.37307 > 10.10.7.4.22: Flags [.], ack 1, win 1021, length 0
20:23:06.226772 IP 10.10.10.140.37307 > 10.10.7.4.22: Flags [.], ack 49, win 1021, length 0
20:23:06.226772 IP 10.10.10.140.37307 > 10.10.7.4.22: Flags [.], ack 49, win 1021, length 0
20:23:07.231196 IP 10.10.10.140.37307 > 10.10.7.4.22: Flags [.], ack 113, win 1021, length 0
20:23:07.231196 IP 10.10.10.140.37307 > 10.10.7.4.22: Flags [.], ack 113, win 1021, length 0
20:23:08.236206 IP 10.10.10.140.37307 > 10.10.7.4.22: Flags [.], ack 177, win 1021, length 0
20:23:08.236206 IP 10.10.10.140.37307 > 10.10.7.4.22: Flags [.], ack 177, win 1021, length 0
20:23:08.756851 LLDP, length 502: jfa3-gale-leaf-118 [|lldp]
20:23:08.756851 LLDP, length 502: jfa3-gale-leaf-118 [|lldp]
20:23:09.239419 IP 10.10.10.140.37307 > 10.10.7.4.22: Flags [.], ack 241, win 1021, length 0
20:23:09.239419 IP 10.10.10.140.37307 > 10.10.7.4.22: Flags [.], ack 241, win 1021, length 0
20:23:10.227412 IP 10.10.10.140.37307 > 10.10.7.4.22: Flags [.], ack 305, win 1026, length 0
20:23:10.227412 IP 10.10.10.140.37307 > 10.10.7.4.22: Flags [.], ack 305, win 1026, length 0
```

As you see, every single packet is duplicated. 
Notice even the same timestamps!

And this is how it should look like:
```
# tcpdump -nnvi eno1 -Qin -w k2.pcap
dropped privs to tcpdump
tcpdump: listening on eno1, link-type EN10MB (Ethernet), snapshot length 262144 bytes
8 packets captured
17 packets received by filter
0 packets dropped by kernel
```

```
# tcpdump -nnr k2.pcap
reading from file k2.pcap, link-type EN10MB (Ethernet), snapshot length 262144
dropped privs to tcpdump
20:24:23.943502 IP 10.10.10.140.37307 > 10.10.7.4.22: Flags [.], ack 2609751449, win 1025, length 0
20:24:24.955513 IP 10.10.10.140.37307 > 10.10.7.4.22: Flags [.], ack 65, win 1025, length 0
20:24:25.959563 IP 10.10.10.140.37307 > 10.10.7.4.22: Flags [.], ack 113, win 1024, length 0
20:24:26.189936 IP6 fe80::9957:b5ff:fe88:6f4.546 > ff02::1:6.547: dhcp6 solicit
20:24:26.964532 IP 10.10.10.140.37307 > 10.10.7.4.22: Flags [.], ack 161, win 1024, length 0
20:24:27.966582 IP 10.10.10.140.37307 > 10.10.7.4.22: Flags [.], ack 209, win 1024, length 0
20:24:28.955398 IP 10.10.10.140.37307 > 10.10.7.4.22: Flags [.], ack 257, win 1024, length 0
20:24:29.961639 IP 10.10.10.140.37307 > 10.10.7.4.22: Flags [.], ack 305, win 1024, length 0
```

This is a final proof that PF-RING is not working correctly on Rocky 9.6 default kernel.

Best Regards,
Karol

**Comment by cardigliano** [comment]
@Roslaniec there is definitely a bug somewhere, we are investigating.
What I do not understand is your pfdump output (pfdump -i eno1 -w k.pcap), it seems packets are not duplicated from the output, but they are in the produced pcap, how is this possible? Is it the same test?

**Comment by Roslaniec** [comment]
Now I'm not 100% sure if this exact `pfdump` output is matching k.pcap, only because LLDP capture counter is missing...
But generally the `pfdump` output and k.pcap are matching.
`pfdump` is reporting continuously 2 pps every second. Inside k.pcap you see 2 packets every sec - all duplicated,  in reality there was 1 packet every sec.
Notice that eno1 is my mgmt interface, running SSH, so what we capture here is effectively the ssh output (to be more precise it is _input_, because I capture only RX). 
`pfdump` is capturing _output_ of `pfdump`, and `tcpdump` was capturing output of `tcpdump`, so they will not match 1-to-1.

**Comment by Roslaniec** [comment]
WOW! **PF-RING-8.8-stable** does not show the problem!
```
# ./pfdump -i eno1 -w k4.pcap
Using PF_RING v.8.8.0
Capturing from eno1 [08:FF:EE:6F:88:EC][ifIndex: 2]
# Device RX channels: 1
1 sec pkts 3 drop 0 bytes 314 | pkts 3 bytes 314 drop 0
2 sec pkts 1 drop 0 bytes 84 | pkts 4 bytes 398 drop 0
3 sec pkts 1 drop 0 bytes 84 | pkts 5 bytes 482 drop 0
4 sec pkts 1 drop 0 bytes 84 | pkts 6 bytes 566 drop 0
5 sec pkts 1 drop 0 bytes 84 | pkts 7 bytes 650 drop 0
6 sec pkts 2 drop 0 bytes 624 | pkts 9 bytes 1274 drop 0
7 sec pkts 1 drop 0 bytes 84 | pkts 10 bytes 1358 drop 0
8 sec pkts 1 drop 0 bytes 84 | pkts 11 bytes 1442 drop 0
Leaving...
9 sec pkts 0 drop 0 bytes 0 | pkts 11 bytes 1442 drop 0
```

```
# tcpdump -nnr k4.pcap
reading from file k4.pcap, link-type EN10MB (Ethernet), snapshot length 16384
dropped privs to tcpdump
13:53:04.939395 IP 10.10.10.140.54254 > 10.10.10.4.22: Flags [.], ack 815755065, win 1024, length 0
13:53:04.990661 IP 10.10.10.140.54255 > 10.10.10.4.22: Flags [P.], seq 4184085153:4184085221, ack 1829591064, win 1023, length 68
13:53:05.006053 IP 10.10.10.140.54255 > 10.10.10.4.22: Flags [.], ack 181, win 1023, length 0
13:53:05.963022 IP 10.10.10.140.54254 > 10.10.10.4.22: Flags [.], ack 97, win 1023, length 0
13:53:06.953585 IP 10.10.10.140.54254 > 10.10.10.4.22: Flags [.], ack 161, win 1023, length 0
13:53:07.958708 IP 10.10.10.140.54254 > 10.10.10.4.22: Flags [.], ack 225, win 1023, length 0
13:53:08.963421 IP 10.10.10.140.54254 > 10.10.10.4.22: Flags [.], ack 289, win 1023, length 0
13:53:09.692139 LLDP, length 502: jfa3-gale-leaf-118 [|lldp]
13:53:09.952827 IP 10.10.10.140.54254 > 10.10.10.4.22: Flags [.], ack 353, win 1022, length 0
13:53:10.957816 IP 10.10.10.140.54254 > 10.10.10.4.22: Flags [.], ack 433, win 1022, length 0
13:53:11.962998 IP 10.10.10.140.54254 > 10.10.10.4.22: Flags [.], ack 497, win 1022, length 0
```

I believe the issue was introduced somewhere in **8.9**...

**Comment by cardigliano** [comment]
@Roslaniec do you *always* see 1 DUP for each packet with PF_RING 8.9+?

**Comment by cardigliano** [comment]
I am running RH9.7 with kernel 5.14.0-611.5.1.el9_7.aarch64 and I am not able to reproduce the same, could you try updating to the same (latest) kernel?

**Comment by huxq2199** [comment]
I have tried extensive packet stress testing, and sometimes the number of packets received is not twice the number sent. And run with kernel5.18.10-1.el7.elrepo.x86_64

**Comment by cardigliano** [comment]
@huxq2199 EL7 is EOL and no longer supported sorry, I cannot test this. I suggest to move to a newer version..

**Comment by Roslaniec** [comment]
Are you testing on ARM? I'm using only x86_64.

I cannot upgrade that machine.

On Friday I can do more tests on virtual machine.

**Comment by cardigliano** [comment]
I also tested on a x86_64 VM

**Comment by Roslaniec** [comment]
According to my tests, this bug was introduced with 2 commits:
https://github.com/ntop/PF_RING/commit/2bc73bd71e454462b2d360cedf173201d36e5c5e
https://github.com/ntop/PF_RING/commit/9b7a7fc15f585b068800accaea54ff99c9eed9a8
Both are related to: **SINGLE_PROT_HOOK**

This is how I was performing tests:
```
HASH=ccb907985ca8d67757284bf11628b0a7d38a586d  # 2025-10-07 no BUG
wget https://github.com/ntop/PF_RING/archive/$HASH.zip
unzip $HASH
cd PF_RING-$HASH

patch -p0 < ../pfring.patch
sudo rm -f /usr/include/linux/pf_ring.h
sudo rmmod pf_ring

cd kernel
make
sudo make install

cd ../userland
./configure --disable-ft
make

sudo ./examples/pfdump -i enp1s0 -w k.pcap
tcpdump -nr k.pcap 
cd ../..
rm -rf PF_RING-$HASH
```

[pfring.patch](https://github.com/user-attachments/files/24972179/pfring.patch)

**Comment by cardigliano** [comment]
@Roslaniec thank you for the useful info. Are you reproducing this on a physical host, VM, or container?

**Comment by cardigliano** [comment]
Also, could you try updating to latest Rocky 9.7 kernel to be on the same page? Thank you

**Comment by Roslaniec** [comment]
The recent tests I've done on `KVM`.
Today I've updated Rocky to 9.7 (from 9.6):
```
Linux rocky9 5.14.0-611.24.1.el9_7.x86_64 #1 SMP PREEMPT_DYNAMIC Fri Jan 23 11:42:43 UTC 2026 x86_64 x86_64 x86_64 GNU/Linux
```
And now I'm really confused, because I don't see the issue...
Is it really the problem with the kernel?
Or maybe there is something else needed to reproduce the problem?

**Comment by Roslaniec** [comment]
I've upgraded real servers to Rocky 9.7 and it seems that the issue of duplicated packets is gone! This is good news.
The bad news is that I still see my initial problem: PF-RING cannot read **gretap** interface.
At least now I know that this is a separate issue and I will not continue this problem here (either I will find workaround or open new issue).

**Comment by cardigliano** [comment]
Great! Yes please open a separate ticket.
