### ISSUE TITLE
truncated-ip message when using zbalance_ipc and tcpdump + BPF

### ISSUE THREAD

**Issue by gianogli** [ntop/PF_RING#252]
I'm using the last pf_ring code (pfring 6.7.0-1397) on an ubuntu server.
My pf_ring/ixgbe_zc configuration is:

```
modprobe pf_ring enable_tx_capture=0
modprobe ixgbe_zc RSS=1,1,1,1,1,1,1,1 numa_cpu_affinity=4,5,6,7,12,13,14,15
```

If I use the zbalance_ipc command to aggregate 2 zc interfaces I can't use anymore the BPF (-f option) with your tcpdump sniffer.

To reproduce the issue you need 2 bash shell:

On the first shell I run this zbalance_ipc command:
```
zbalance_ipc -i zc:eth8,zc:eth9 -c0 -n5 -m2 -p
```

On the second shell if I run this tcpdump command all works fine:
```
tcpdump -nK -s0 -i zc:0@0
```

if I run instead something like that:
```
tcpdump -nK -s0 -i zc:0@0 -f host 8.8.8.8
```
after 4/5 seconds I can see a lot of `truncated-ip` errors from tcpdump.

At this point if I stop the tcpdump instance with CTRL-C, I have the `truncated-ip` errors even if I re-run the first tcpdump command (without BPF).

if I stop the zbalance_ip instance and I re-run all the tcpdump commands directly to the zc:eth8 or zc:eth9 interfaces all works as expected (with or without BPF):
```
tcpdump -nK -s0 -i zc:eth9
tcpdump -nK -s0 -i zc:eth9 -f host 8.8.8.8
```

We had no `truncated-ip` errors when we used pf_ring 6.7.0-1375.

Could you investigate on this issue?
If you need other information feel free to ask... ;-)

Thanks...

**Comment by cardigliano** [comment]
@gianogli I am trying to reproduce this using latest 6.7 code from git (with no success so far), 
are you using the tcpdump shipped with pf_ring?

**Comment by gianogli** [comment]
@cardigliano 
I've just tried to update our pf_ring environment but I notice the problem again.
I use the pf_ring code from these repositories:
```
deb http://packages.ntop.org/apt/16.04/ x64/
deb http://packages.ntop.org/apt/16.04/ all/
```
Then I compile manually the tcpdump code (why the tcpdump executable is not directly into the pfring packet?) by downloading from git your code in this way:
```
git clone https://github.com/ntop/PF_RING.git
cd PF_RING
make
cd userland/tcpdump
./configure
make
```
Some versioning information:
```
# zcount -v
zcount - (C) 2014 ntop.org
Using PFRING_ZC v.6.7.0.170829
A simple packet counter application.

# ./tcpdump --version
tcpdump version 4.9.0
libpcap version 1.7.4
OpenSSL 1.0.2g  1 Mar 2016
```

Bash shell n.1:
```
# zbalance_ipc -i zc:eth8,zc:eth9 -c0 -n5 -m2 -p
11/Sep/2017 09:04:39 [zbalance_ipc.c:903] Starting balancer with 5 consumer queues..
11/Sep/2017 09:04:39 [zbalance_ipc.c:913] Run your application instances as follows:
11/Sep/2017 09:04:39 [zbalance_ipc.c:918]       pfcount -i zc:0@0
11/Sep/2017 09:04:39 [zbalance_ipc.c:918]       pfcount -i zc:0@1
11/Sep/2017 09:04:39 [zbalance_ipc.c:918]       pfcount -i zc:0@2
11/Sep/2017 09:04:39 [zbalance_ipc.c:918]       pfcount -i zc:0@3
11/Sep/2017 09:04:39 [zbalance_ipc.c:918]       pfcount -i zc:0@4
11/Sep/2017 09:04:40 [zbalance_ipc.c:233] =========================
[...]
```

Bash shell n.2 (tcpdump without BPF filters):
```
# ./tcpdump -nK -s0 -i zc:0@0 | grep truncate
tcpdump: verbose output suppressed, use -v or -vv for full protocol decode
listening on zc:0@0, link-type EN10MB (Ethernet), capture size 262144 bytes
^C833837 packets captured
833837 packets received by filter
0 packets dropped by kernel
```

Bash shell n.2 (tcpdump with BPF filters):
```
p# ./tcpdump -nK -s0 -i zc:0@0 -f port 22 | grep truncate
tcpdump: verbose output suppressed, use -v or -vv for full protocol decode
listening on zc:0@0, link-type EN10MB (Ethernet), capture size 262144 bytes
09:06:44.821373 IP truncated-ip - 1376 bytes missing! X.X.X.X.443 > X.X.X.X.58369: Flags [.], seq 1275472340:1275473740, ack 3376499503, win 123, length 1400
09:06:45.254869 IP truncated-ip - 159 bytes missing! X.X.X.X.443 > X.X.X.X.62909: Flags [.], seq 3953323149:3953323302, ack 2015817795, win 65160, options [nop,nop,TS[|tcp]>
09:06:45.474590 IP truncated-ip - 1428 bytes missing! X.X.X.X.54199 > X.X.X.X.443: Flags [P.], seq 1483971:1485411, ack 1, win 254, length 1440
09:06:45.977212 IP truncated-ip - 714 bytes missing! X.X.X.X.22 > X.X.X.X.58904: Flags [P.], seq 862:1582, ack 580, win 16616, length 720
09:06:46.239054 IP truncated-ip - 80 bytes missing! X.X.X.X.22 > X.X.X.X.32286: Flags [FP.], seq 0:80, ack 1, win 243, options [nop,nop,TS val 2267788407 ecr 364922417], length 80
09:06:46.239069 IP truncated-ip - 80 bytes missing! X.X.X.X.22 > X.X.X.X.32286: Flags [FP.], seq 0:80, ack 1, win 243, options [nop,nop,TS val 2267788407 ecr 364922417], length 80
09:06:46.239078 IP truncated-ip - 80 bytes missing! X.X.X.X.22 > X.X.X.X.32286: Flags [FP.], seq 0:80, ack 1, win 243, options [nop,nop,TS val 2267788407 ecr 364922417], length 80
09:06:46.475223 IP truncated-ip - 739 bytes missing! X.X.X.X.443 > X.X.X.X.51633: Flags [P.], seq 1346967510:1346968257, ack 2488421640, win 790, options [nop,nop,TS val 358966090 ecr 790134508], length 747
09:06:46.495568 IP truncated-ip - 41 bytes missing! X.X.X.X.22 > X.X.X.X.42322: Flags [P.], seq 1:42, ack 42, win 227, options [nop,nop,TS val 3580030973 ecr 15404950], length 41
^C244 packets captured
340371 packets received by filter
0 packets dropped by kernel
```

What do you think? How can I help you to debug this issue?

Thanks...

**Comment by gianogli** [comment]
@cardigliano Any news? I've just updated all the software to the last available version to make a new test but the issue persists. :-(

**Comment by gianogli** [comment]
I've just tried with the new tcpdump (4.9.2) and with the last libpcap (1.8.1) but the issue persists... :-(

**Comment by gianogli** [comment]
I still have this issue also after the today update...

**Comment by cardigliano** [comment]
@gianogli any chance to provide access to this system?

**Comment by gianogli** [comment]
@cardigliano yes, sure! Could I have your private e-mail contact? I will send you all the information you need to connect via SSH to our server... Thanks...

**Comment by cardigliano** [comment]
cardigliano@ntop.org

**Comment by gianogli** [comment]
@cardigliano Could you confirm me that you received my personal e-mail? Thanks... :-)

**Comment by cardigliano** [comment]
Fixed, please reopen in case

**Comment by gianogli** [comment]
@cardigliano I've just tested it and I can confirm you that it works again as expected. Thanks for your support... :-)
